{
  "$schema": "https://json-schema.org/draft/2020-12/schema",
  "$id": "https://pip-progress-tracker/contracts/progress.schema.json",
  "title": "PIP Progress Document",
  "description": "The single source of truth for the PIP Progress Tracker (progress.json). Renders and rolls up entirely from this document; the app hardcodes no goal content.",
  "type": "object",
  "additionalProperties": false,
  "required": ["schemaVersion", "meta", "checkpoints", "goals"],
  "properties": {
    "schemaVersion": {
      "type": "string",
      "description": "Semantic version of the data shape.",
      "pattern": "^\\d+\\.\\d+\\.\\d+$"
    },
    "meta": { "$ref": "#/$defs/metadata" },
    "checkpoints": {
      "type": "array",
      "description": "Ordered biweekly checkpoints. Exactly 8, 14 days apart, 2026-07-15 to 2026-10-15.",
      "minItems": 8,
      "maxItems": 8,
      "items": { "$ref": "#/$defs/checkpoint" }
    },
    "goals": {
      "type": "array",
      "description": "The PIP goals.",
      "items": { "$ref": "#/$defs/goal" }
    }
  },
  "$defs": {
    "date": {
      "type": "string",
      "pattern": "^\\d{4}-\\d{2}-\\d{2}$",
      "description": "Calendar date in YYYY-MM-DD format."
    },
    "progressValue": {
      "type": "number",
      "minimum": 0,
      "maximum": 100,
      "description": "A recorded progress value, 0-100 (stored unrounded; slider step is 5)."
    },
    "metadata": {
      "type": "object",
      "additionalProperties": false,
      "required": ["title", "periodStart", "periodEnd", "lastUpdated"],
      "properties": {
        "title": { "type": "string" },
        "owner": { "type": "string" },
        "periodStart": { "$ref": "#/$defs/date" },
        "periodEnd": { "$ref": "#/$defs/date" },
        "lastUpdated": { "$ref": "#/$defs/date", "description": "Stamped on export with the current date." }
      }
    },
    "checkpoint": {
      "type": "object",
      "additionalProperties": false,
      "required": ["id", "date", "label"],
      "properties": {
        "id": { "type": "string", "description": "Stable identifier; used as the key in task.progressByCheckpoint." },
        "date": { "$ref": "#/$defs/date" },
        "label": { "type": "string" }
      }
    },
    "goal": {
      "type": "object",
      "additionalProperties": false,
      "required": ["id", "title", "placeholder", "subGoals"],
      "properties": {
        "id": { "type": "string" },
        "title": { "type": "string" },
        "outcome": { "type": "string" },
        "dueDate": { "$ref": "#/$defs/date" },
        "weight": { "type": "number", "minimum": 0, "description": "Roll-up weight among goals; defaults to equal weighting when absent." },
        "status": { "type": "string", "description": "Author hint only; displayed badge is derived from computed progress." },
        "placeholder": { "type": "boolean", "description": "true until sourced; placeholder goals have empty subGoals, render 0% and contribute 0% to roll-up while still weighted equally." },
        "source": { "type": "string", "description": "Authoritative source (URL or 'PIP document')." },
        "notes": { "type": "string" },
        "subGoals": {
          "type": "array",
          "description": "May be empty for a placeholder goal.",
          "items": { "$ref": "#/$defs/subGoal" }
        }
      }
    },
    "subGoal": {
      "type": "object",
      "additionalProperties": false,
      "required": ["id", "title", "tasks"],
      "properties": {
        "id": { "type": "string" },
        "title": { "type": "string" },
        "weight": { "type": "number", "minimum": 0, "description": "Weight within the parent goal; simple average when siblings lack weights." },
        "tasks": {
          "type": "array",
          "description": "May be empty; an empty sub-goal rolls up to 0%.",
          "items": { "$ref": "#/$defs/task" }
        }
      }
    },
    "task": {
      "type": "object",
      "additionalProperties": false,
      "required": ["id", "title", "progressByCheckpoint"],
      "properties": {
        "id": { "type": "string" },
        "title": { "type": "string" },
        "estHours": { "type": "number", "minimum": 0 },
        "resourceUrl": { "type": "string", "format": "uri", "description": "Opens in a new tab on user click only." },
        "weight": { "type": "number", "minimum": 0, "description": "Weight within the sub-goal; defaults to 1 (equal average) when absent." },
        "progressByCheckpoint": {
          "type": "object",
          "description": "Sparse map of checkpoint id -> progress value. Gaps are filled by carry-forward at render time.",
          "propertyNames": { "type": "string" },
          "additionalProperties": { "$ref": "#/$defs/progressValue" }
        }
      }
    }
  }
}
